[6/22/14, 9:27:24 AM] Senthil Mama Dubai: тАОSenthil Mama Dubai created group тАЬPR K S FlyтАЭ
[6/22/14, 9:27:24 AM] PR K S Fly: тАОYou added PR K S Fly
тАО[1/1/24, 8:49:54 PM] Santha Amma: тАОGIF omitted
тАО[1/5/24, 8:59:12 AM] Senthil Mama Dubai: тАО<attached: 00000001-PHOTO-2024-01-05-08-59-13.jpg>
[1/5/24, 9:00:34 AM] Seetha Mami: Athais Birthday ЁЯЩПЁЯП╗ЁЯЩПЁЯП╗
[1/14/24, 11:45:55 PM] Seetha Mami: Happy Pongal to you all
тАО[1/15/24, 1:07:56 AM] Janagi Cousin: тАО<attached: 00000004-PHOTO-2024-01-15-01-07-57.jpg>
[1/18/24, 10:06:53 PM] Mani Mama Main: Divya many more happy returns of the day
     Anbudan mama,mami
[1/18/24, 10:08:11 PM] Mani Mama Main: ЁЯТРЁЯТРЁЯОВЁЯОВ
[1/18/24, 10:19:44 PM] Seetha Mami: Happy Birthday Divya ЁЯТРЁЯОВЁЯТРStay Blessed
[1/18/24, 10:19:59 PM] Senthil Mama Dubai: Many More Happy Returns of the Day DB.ЁЯОВЁЯТРЁЯОВЁЯТРЁЯОВLong Live. God Bless You.
[1/18/24, 10:20:32 PM] Janagi Cousin: Happy birthday divya akkaЁЯТРЁЯТРЁЯТР
[1/18/24, 10:31:50 PM] Unna Mami: Happy birthday Divya ЁЯТРЁЯТРЁЯТР
[1/19/24, 12:28:25 AM] Ramah Chitti: Happy Birthday DivyaЁЯТРЁЯТР
[1/19/24, 1:27:10 AM] Divya Sister: Thank you mani mama, Kavitha mami, seetha mami, senthi mama, janu, unna mami, chitti ЁЯШКЁЯШКЁЯШК
тАО[1/19/24, 1:27:17 AM] Nithyalalita Senthil Dubai: тАО<attached: 00000013-PHOTO-2024-01-19-01-27-18.jpg>
[1/19/24, 1:27:32 AM] Divya Sister: Thank you Nithya ЁЯШКЁЯШК
[1/19/24, 3:32:14 AM] Karthik 2 Cousin: Happy birthday divya akka...ЁЯОКЁЯОЙЁЯе│
[1/19/24, 6:49:18 AM] Divya Sister: Tnk yo Karthik ЁЯШКЁЯШК
тАО[1/22/24, 4:04:09 AM] Mani Mama Main: тАО<attached: 00000017-VIDEO-2024-01-22-04-04-10.mp4>
тАО[1/24/24, 8:50:34 PM] Seetha Mami: тАО<attached: 00000018-PHOTO-2024-01-24-20-50-35.jpg>
тАО[1/24/24, 8:50:51 PM] Seetha Mami: тАО<attached: 00000019-PHOTO-2024-01-24-20-50-52.jpg>
тАО[1/24/24, 8:51:12 PM] Seetha Mami: тАО<attached: 00000020-PHOTO-2024-01-24-20-51-13.jpg>
тАО[1/24/24, 9:01:03 PM] Ramah Chitti: тАО<attached: 00000021-PHOTO-2024-01-24-21-01-04.jpg>
тАО[1/24/24, 10:27:48 PM] Senthil Mama Dubai: тАО<attached: 00000022-PHOTO-2024-01-24-22-27-49.jpg>
тАО[1/25/24, 4:48:50 AM] Mani Mama Main: тАО<attached: 00000023-PHOTO-2024-01-25-04-48-51.jpg>
тАО[1/25/24, 4:49:24 AM] Mani Mama Main: тАО<attached: 00000024-PHOTO-2024-01-25-04-49-25.jpg>
тАО[1/25/24, 4:49:46 AM] Mani Mama Main: тАО<attached: 00000025-PHOTO-2024-01-25-04-49-47.jpg>
тАО[1/25/24, 4:49:47 AM] Mani Mama Main: тАО<attached: 00000026-PHOTO-2024-01-25-04-49-48.jpg>
[1/25/24, 8:27:22 PM] Mani Mama Main: Happy 20th wedding anniversary Palani and unna.ЁЯОВЁЯОВЁЯТРЁЯТР
тАО[1/25/24, 8:35:13 PM] Mani Mama Main: тАО<attached: 00000028-VIDEO-2024-01-25-20-35-14.mp4>
[1/25/24, 10:03:24 PM] Seetha Mami: Happy Wedding Anniversary Palaniappannan and Unna ЁЯТРЁЯОВЁЯТРStay Blessed
[1/25/24, 10:08:47 PM] Senthil Mama Dubai: роЗройро┐роп 20ро╡родрпБ родро┐ро░рпБроорог роиро╛ро│рпН ро╡ро╛ро┤рпНродрпНродрпБроХро│рпН  рокро┤ройро┐ропрокрпНрокройрпН & роЙрогрпНрогро╛ ЁЯТРЁЯТРЁЯТРЁЯТРЁЯТР роОро▓рпНро▓ро╛ ро╡ро│роорпБроорпН рокрпЖро▒рпНро▒рпБ роирпАроЯрпВро┤ро┐ ро╡ро╛ро┤ роОро▓рпНро▓ро╛роорпНро╡ро▓рпНро▓ роЗро▒рпИро╡ройро┐роЯроорпН ро╡рпЗрогрпНроЯрпБроХро┐ро▒рпЛроорпН.
[1/25/24, 10:56:10 PM] Mani Mama Main: тАОThis message was deleted.
[1/25/24, 10:58:10 PM] Mani Mama Main: Happy wedding anniversary unna and palaniappannan ЁЯОВЁЯОВЁЯТРЁЯТР
[1/26/24, 12:37:24 AM] Divya Sister: Happy anniversary palam mama n unna mami ЁЯОВЁЯе│
[1/26/24, 12:43:52 AM] Santha Amma: Happy wedding anniversary Palaniappan & Unna
[1/26/24, 1:46:02 AM] Unna Mami: Thank you mani annan,seetha Achi, senthil annan, kavitha Achi, Divya, ayithiyandi
[1/26/24, 3:24:03 AM] Meiyappan Appa Appachi: Happy  wedding  anniversary  palaniappan and unna
[1/26/24, 7:00:39 AM] Unna Mami: Thank you  annan
[1/26/24, 8:19:02 AM] Uma Wifey Pendati: Happy Wedding anniversary chittapa and chitti
[1/26/24, 8:41:37 AM] Unna Mami: Thank you uma
[1/26/24, 11:28:42 AM] Karthik 2 Cousin: тАОThis message was deleted.
[1/26/24, 11:39:47 AM] Karthik 2 Cousin: Happy wedding anniversary chittapa and chitti
[1/26/24, 11:41:12 AM] Karthik 2 Cousin: ЁЯТРЁЯОВЁЯТРЁЯОВ
[1/26/24, 11:09:04 PM] Unna Mami: Thank you karthi
тАО[1/29/24, 9:36:30 AM] Mani Mama Main: тАО<attached: 00000044-VIDEO-2024-01-29-09-36-31.mp4>
[2/1/24, 8:47:13 PM] Unna Mami: тАОThis message was deleted.
[2/1/24, 8:49:45 PM] Unna Mami: Happy 37th wedding anniversary  ayithiyandi and annanЁЯМ╖ЁЯСПЁЯОВЁЯТРЁЯЩП
[2/1/24, 10:25:14 PM] Seetha Mami: Happy Wedding Anniversary Ayithan and Akka ЁЯТРЁЯОВЁЯТРVazhga Valamudan
[2/1/24, 11:27:51 PM] Senthil Mama Dubai: роЗройро┐роп родро┐ро░рпБроорог роиро╛ро│рпН ро╡ро╛ро┤рпНродрпНродрпБроХро│рпН родрпЗройрпНроорпКро┤ро┐ & роЕропрпНродродрпНродро╛ройрпН ЁЯТРЁЯТРЁЯТРЁЯТРЁЯТР  роОро▓рпНро▓ро╛ ро╡ро│роорпБроорпН рокрпЖро▒рпНро▒рпБ роирпАроЯрпВро┤ро┐ ро╡ро╛ро┤ роОро▓рпНро▓ро╛роорпНро╡ро▓рпНро▓ роЗро▒рпИро╡ройро┐роЯроорпН ро╡рпЗрогрпНроЯрпБроХро┐ро▒рпЛроорпН.
[2/2/24, 12:14:49 AM] Mani Mama Main: Many more Happy wedding anniversary wishes Thenmozhi and Ayithan...
[2/2/24, 2:25:01 AM] Mani Mama Main: Happy wedding anniversary Akka and Ayithan ЁЯОВЁЯОВЁЯТРЁЯТР
[2/2/24, 3:02:03 AM] Janagi Cousin: Happy wedding anniversary Santha Athai and Meyappan Mama ЁЯТРЁЯТРЁЯТР
[2/2/24, 3:42:12 AM] Santha Amma: Thanks for all your lovable wishes-Santha&Meiyappan
тАО[2/2/24, 10:39:56 PM] Mani Mama Main: тАО<attached: 00000053-PHOTO-2024-02-02-22-39-57.jpg>
тАО[2/2/24, 10:41:26 PM] Mani Mama Main: тАО<attached: 00000054-VIDEO-2024-02-02-22-41-27.mp4>
[2/2/24, 10:44:08 PM] Mani Mama Main: роороХрпНроХро│рпН роЕро▓рпИ@ роЕро╡ро┐ройро╛роЪро┐
[2/4/24, 6:57:05 PM] Seetha Mami: Happy Birthday Akka ЁЯТРЁЯОВЁЯТРStay Blessed
[2/4/24, 8:52:00 PM] Senthil Mama Dubai: роЗройро┐роп рокро┐ро▒роирпНрод роиро╛ро│рпН ро╡ро╛ро┤рпНродрпНродрпБроХро│рпН родрпЗройрпНроорпКро┤ро┐ ЁЯТРЁЯОВЁЯТРЁЯОВЁЯТРЁЯОВЁЯТР. роОро▓рпНро▓ро╛ ро╡ро│роорпБроорпН рокрпЖро▒рпНро▒рпБ, родрооро┐ро┤рпН рокрпЛро▓, роирпАроЯрпВро┤ро┐ ро╡ро╛ро┤ роОро▓рпНро▓ро╛роорпНро╡ро▓рпНро▓ роЗро▒рпИро╡ройро┐роЯроорпН ро╡рпЗрогрпНроЯрпБроХро┐ро▒рпЛроорпН.
[2/4/24, 8:53:26 PM] Mani Mama Main: Happy birthday Akka ЁЯТРЁЯОВ
тАО[2/4/24, 8:58:33 PM] Mani Mama Main: тАО<attached: 00000059-PHOTO-2024-02-04-20-58-34.jpg>
[2/4/24, 10:15:30 PM] Santha Amma: Thank you for your lovable wishes-Seetha,Senthi & Kavitha
[2/4/24, 11:01:12 PM] Mani Mama Main: тАОThis message was deleted.
[2/4/24, 11:07:49 PM] Mani Mama Main: "Wish u very Happy returns of the day Thenmozhi.".ЁЯТРЁЯТРЁЯОВЁЯОВ
Today is also special as,
Facebook's birthday,
Farmer's day,
Homemade soup day.
World cancer day and so on.
[2/4/24, 11:09:15 PM] Santha Amma: Thanks a lot Mani for your kind wishes
[2/4/24, 11:09:37 PM] Santha Amma: Belated birthday wishes Janu
[2/4/24, 11:59:19 PM] Mani Mama Main: Belated birthday wishes januu ЁЯОВЁЯОВЁЯТРЁЯТР
[2/5/24, 12:08:50 AM] Divya Sister: Belated Happy Birthday janu ЁЯШКЁЯе│
[2/5/24, 12:17:15 AM] Seetha Mami: Belated Birthday Wishes Janu ЁЯТРЁЯОВЁЯТРStay Blessed Dear
[2/5/24, 12:20:40 AM] Senthil Mama Dubai: Belated Birthday wishes Janu. ЁЯТРЁЯТРЁЯТР S
[2/5/24, 1:12:34 AM] Janagi Cousin: Thank you athai
[2/5/24, 1:12:47 AM] Janagi Cousin: Thank you divya akka
[2/5/24, 1:12:58 AM] Janagi Cousin: Thank you  kavitha periyamma тАО<This message was edited>
[2/5/24, 1:13:30 AM] Janagi Cousin: Thank you periyamma
[2/5/24, 1:13:40 AM] Janagi Cousin: Thank you periyappa
[2/5/24, 1:29:22 AM] Janagi Cousin: Many more happy returns of the day athai.Let ur birthday be as sweet as your birthday ЁЯН░ЁЯН░ЁЯН░ тАО<This message was edited>
[2/5/24, 1:31:46 AM] Unna Mami: Happy birthday ayithiyandi ЁЯТРЁЯТРЁЯТР
[2/5/24, 2:27:46 AM] Meiyappan Appa Appachi: Many more happy returns of the day janu
[2/5/24, 2:28:11 AM] Janagi Cousin: Thank you Mama
[2/5/24, 2:49:32 AM] Karthik 2 Cousin: Happy birthday athai
[2/5/24, 2:49:39 AM] Karthik 2 Cousin: ЁЯе│ЁЯе│
[2/5/24, 2:50:05 AM] Karthik 2 Cousin: Belated Happy Birthday jannu..ЁЯе│ЁЯОВ
[2/5/24, 2:50:44 AM] Janagi Cousin: Thank you karthik Anna
[2/5/24, 7:23:03 AM] Ramah Chitti: Happy birthday Akka ЁЯОЙЁЯТРЁЯТР
[2/5/24, 7:23:31 AM] Ramah Chitti: Belated birthday wishes Janu ЁЯТРЁЯТР
[2/5/24, 7:56:44 AM] Janagi Cousin: Thank you Ramah athai тАО<This message was edited>
[2/5/24, 11:16:42 AM] Santha Amma: Thanks Janu
[2/5/24, 11:16:43 AM] Santha Amma: Thanks Unna
[2/5/24, 11:16:44 AM] Santha Amma: Thanks Karthi
[2/5/24, 11:56:06 AM] Santha Amma: Thanks Ramu
[2/5/24, 7:22:55 PM] Ramah Chitti: тАОRamah Chitti changed this group's icon
[2/8/24, 2:06:42 AM] Unna Mami: Happy birthday sahana nachammaiЁЯНлЁЯНлЁЯНл
[2/8/24, 2:56:48 AM] Mani Mama Main: Happy returns of the day chutty sahana  ЁЯОВЁЯОВЁЯОВЁЯУН
[2/8/24, 3:00:25 AM] Senthil Mama Dubai: Many More Happy Returns of the Day Sahana ЁЯОВЁЯТРЁЯОВЁЯТРЁЯОВLong Live. God Bless You.
тАО[2/8/24, 4:21:40 AM] Mani Mama Main: тАОimage omitted
[2/8/24, 4:22:47 AM] Janagi Cousin: Happy birthday Sahana  ЁЯТРЁЯТРЁЯТРStay blessed
[2/8/24, 4:27:20 AM] Seetha Mami: Happy Birthday Sahana Baby ЁЯТРЁЯОВЁЯТРStay Blessed
[2/8/24, 6:32:22 AM] Karthik 2 Cousin: Happy birthday sahana kutti... ЁЯОВЁЯе│ЁЯОВ
тАО[2/8/24, 6:35:17 AM] Ramah Chitti: тАОimage omitted
[2/8/24, 11:14:34 AM] Divya Sister: Tnk yo everyone fr ur lovely wishes ЁЯе░ЁЯе░ЁЯе░
тАО[2/12/24, 9:34:29 AM] Senthil Mama Dubai: тАОimage omitted
[2/12/24, 9:34:47 AM] Senthil Mama Dubai: роЕройрпИродрпНродрпБ роЕройрпБроЪро░рогрпИроХро│рпБроХрпНроХрпБроорпН роОройрпНройрпИ +971559565670 роОройрпНро▒ WhatsApp роЕро▓рпНро▓родрпБ +919585294622 роОройрпНро▒ роЗроирпНродро┐роп родрпКро▓рпИрокрпЗроЪро┐ропро┐ро▓рпН родрпКроЯро░рпНрокрпБ роХрпКро│рпНро│ ро╡рпЗрогрпНроЯрпБроХро┐ро▒рпЗройрпН
[2/12/24, 9:41:45 AM] Senthil Mama Dubai: роиро╛ройрпН, роЪрпАродро╛ рооро▒рпНро▒рпБроорпН роиро┐родрпНропро╛ 18роирпН родрпЗродро┐ рокрпКройрпНройрооро░ро╛ро╡родро┐ ро╡ро░рпБроХро┐ро▒рпЛроорпН. 

роЪроорпИропро▓рпБроХрпНроХрпБ 18роирпН родрпЗродро┐ роорпБродро▓рпН роПро▒рпНрокро╛роЯрпБ роЪрпЖропрпНродрпБ роЗро░рпБроХрпНроХро┐ро▒рпЛроорпН. 

роОро▓рпНро▓рпЛро░рпБроорпН роЙро▒рпНро▒ро╛ро░рпН рооро▒рпНро▒рпБроорпН роирогрпНрокро░рпНроХро│рпБроЯройрпН 18роирпН родрпЗродро┐ роорпБродро▓рпЗ ро╡роирпНродро┐ро░рпБроирпНродрпБ роОро▓рпНро▓ро╛ роиро┐роХро┤рпНроЪрпНроЪро┐роХро│ро┐ро▓рпБроорпН роХро▓роирпНродрпБ роХрпКрогрпНроЯрпБ, роХрпБроорпНрокро╛рокро┐роЪрпЗроХ ро╡ро┐ро┤ро╛ро╡рпИ роЪро┐ро▒рокрпНрокро┐роХрпНроХ роЕройрпНрокрпБроЯройрпН роЕро┤рпИроХрпНроХро┐ро▒рпЛроорпН
[2/13/24, 9:16:47 AM] Senthil Mama Dubai: роЕройрпНрокрпБроЯрпИропрпАро░рпН ро╡рогроХрпНроХроорпН.ЁЯЩПЁЯП╗
     
         роЗрокрпНрокро╡рпБроорпН роироородрпБ роКро░рпН роироХро░роЪрпН роЪро┐ро╡ро╛ро▓роп роороЩрпНроХро▓ роиройрпНройрпАро░ро╛роЯрпНроЯрпБ ро╡ро┐ро┤ро╛ро╡ро┐ро▒рпНроХро╛рой роиройрпНроХрпКроЯрпИроХро│рпН ро╡рпЖроХрпБ роЪро┐ро▒рокрпНрокро╛роХ ро╡роирпНродрпБ роХрпКрогрпНроЯро┐ро░рпБрокрпНрокродрпИ роиро╛роорпН роЕройрпИро╡ро░рпБроорпН роХро╛рогрпНроХро┐ро▒рпЛроорпН.

        роЗро╡рпНро╡рпЗро│рпИропро┐ро▓рпН роироородрпБ ро╡рпАроЯрпНроЯрпБрокрпН рокрпЖрогрпНрокро┐ро│рпНро│рпИроХро│рпН роТро╡рпНро╡рпКро░рпБро╡ро░рпБроорпН 
роЗроирпНродрокрпН рокрпЖро░рпБ 
роиро┐роХро┤рпНро╡ро┐ро▓рпН рокроЩрпНроХрпЗро▒рпНро▒рпБ роиройрпНроХрпКроЯрпИроХро│рпН родро╛ро░ро╛ро│рооро╛ропрпНродрпН родроирпНродрпБ 
роироирпНродро┐ропрпЖроорпНрокрпЖро░рпБрооро╛ройро┐ройрпН роиро▓рпНро▓ро░рпБро│рпН рокрпЖро▒ро╡рпЗрогрпНроЯрпБроорпН.

роиро╛роорпБроорпН роЗроирпНрод роиро▒рпНроХро╛ро░ро┐ропродрпНродро┐ро▓рпН роЕро╡ро░рпНроХро│рпИропрпБроорпН роИроЯрпБрокроЯроЪрпН роЪрпЖропрпНродрпБ роХрпБроорпНрокро╛рокро┐ро╖рпЗроХ ро╡ро┐ро┤ро╛ро╡ро┐ро▓рпН роЕройрпИро╡ро░рпБроорпН рокрпЖро░рпБро╡ро╛ро░ро┐ропро╛роХроХрпН
роХро▓роирпНродрпБ роХрпКрогрпНроЯрпБ роЪро┐ро▒рокрпНрокро┐роХрпНроХрпБроорпНрокроЯро┐ 
роЪрпЖропрпНроп ро╡рпЗрогрпНроЯрпБроорпН.
[2/14/24, 4:25:29 AM] Seetha Mami: Copy, Paste, Add, Post роЪрпЖропрпНропро╡рпБроорпН

https://chat.whatsapp.com/EFnHl9n1YqSKzorejcvSrs
-- ро╡ро┐ро░рпБрокрпНрокроорпН родрпЖро░ро┐ро╡ро┐рокрпНрокро╡ро░рпНроХро│рпН, роЗроирпНрод WhatsApp роХрпБро┤рпБро╡ро┐ро▓рпН рокрпЖрогрпНроХро│рпН роороЯрпНроЯрпБроорпЗ роЗрогрпИропро╡рпБроорпН

роироородрпБ роХрпЛро╡ро┐ро▓ро┐ро▓рпН роХрпБроорпНрокро╛рокро┐ро╖рпЗроХродрпНродро┐ро▒рпНроХрпБ рокрпЖрогрпНроХро│рпН ро╡рпЗро▓рпИроХро│рпН
роТро░рпБроЩрпНроХро┐ройрпИрокрпНрокро╛ро│ро░рпН:  - 98405 65334 роЪро┐ро╡роХро╛рооро┐ роЪрпЛроороЪрпБроирпНродро░роорпН роЖроЪрпНроЪро┐

1) роХрпЛро▓роорпН рокрпЛроЯрпБродро▓рпН
2) ропро╛роХроЪро╛ро▓рпИрокрпН рокрпКро░рпБроЯрпНроХро│рпИ  роЪрпЗроХро░ро┐родрпНродро▓рпН
3) ропро╛роХроЪро╛ро▓рпИроХрпНроХрпБ рокроХрпНродро░рпНроХро│ро┐роЯрооро┐ро░рпБроирпНродрпБ рокрпВроХрпНроХро│рпН роЪрпЗроХро░ро┐родрпНродро▓рпН
4) ропро╛роХроЪро╛ро▓рпИ роорпБроЯро┐роирпНродрпБ роХрпБроЯроЩрпНроХро│рпН ро░роЪро┐родрпБ ро╡ро╛роЩрпНроХро┐роХрпНроХрпКрогрпНроЯрпБ ро╡ро┐роиро┐ропрпЛроХро┐рокрпНрокродрпБ
5) роХро╛ро│ро╛роЮрпНроЪро┐рокрпН рокрпИроХро│рпН родропро╛ро░ро┐родрпНродро▓рпН

--------------------
*ро╡ро┐ро░рпБрокрпНрокроорпН родрпЖро░ро┐ро╡ро┐родрпНродро╡ро░рпНроХро│рпН:*
94860 69492 Mrs.Annam Murugan
94444 56753 Che Meena Nagappan   
99429 90005 Tri  Theivanai Ramu  
95971 47644 Jayasree Karthick
99650 68592 A. Vijaya - 
+971505051970 Seetha Kasi
88258 24339 T.Meenakshi
94835 11161 Priya
99621 57671 Chinthamani Ramkumar
75983 47539 Chithra Subramanian
98846 91100 KR.Padma 
94871 82281 Meena Chidhambaram
90947 62400 Papayee Adaikkappan
99767 89214 Meena Thyagu

--------------------
*роХро╛ро│роЮрпНроЪро┐рокрпН рокрпИроХро│рпН родропро╛ро░ро┐родрпНродро▓рпН*
95006 02962 Saraswathi Nagappan
99438 99981 Annu Meena

--------------------
*ропро╛роХроЪро╛ро▓рпИ роорпБроЯро┐роирпНродрпБ роХрпБроЯроЩрпНроХро│рпН ро░роЪро┐родрпБ ро╡ро╛роЩрпНроХро┐роХрпНроХрпКрогрпНроЯрпБ ро╡ро┐роиро┐ропрпЛроХро┐рокрпНрокродрпБ*
94871 82273 Valliammai Palaniappan (Gandhigram)

--------------------
*родро┐ро░рпБроирпАро▒рпБ роХрпБроЩрпНроХрпБроороорпН рокро┐ро░роЪро╛родрокрпН рокрпИроХро│рпН роороЯро┐роХрпНроХ*
94875 23458 роЪроирпНродро┐ро░ро╛ рокро┤ройро┐ропрокрпНрокройрпН 

--------------------
*роХрпЛро▓роорпН рокрпЛроЯрпБродро▓рпН*
1.91633 86189 роХро▓рпНропро╛рогро┐ M, W/o M роорпЖропрпНропрокрпНрокройрпН, рокрпЖро░ро┐роп ро╡рпИродрпНродро┐ропроиро╛родройрпН роЪрпЖроЯрпНроЯро┐ропро╛ро░рпН ро╡рпАроЯрпБ

2.95006 02962 Saraswathi Nagappan
3.73587 65292 Meena Nachiappan
4.99438 99981 Annu Meena
5.98406 99193/97916 20940 Alamelu Subbiah
6.63848 26400 роЗроирпНродро┐ро░ро╛ роорпБродрпНродрпБро░ро╛рооройрпН
7.роЕро▓роорпЗро▓рпБ роорпБро░рпБроХ рокро┤роиро┐ропрокрпНрокройрпН (9789745808)

роХрпЛропро┐ро▓рпН роорпБро┤рпБро╡родрпБроорпН рооро╛ро╡ро┐ро▓рпН роХрпЛро▓роорпН роЗроЯ ро╡рпЗрогрпНроЯрпБроорпН.
роЕродройро╛ро▓рпН роХрпЛро▓роХрпН роХрпВроЯрпБроХро│рпН родрпЗро╡рпИрокрпНрокроЯрпБроорпН.
роЗройрпНройрпБроорпН 8 роорпБро┤рпБ ро╡рпЗро╖рпНроЯро┐ родрпБрогро┐роХро│рпБроорпН родрпЗро╡рпИрокрпНрокроЯрпБроорпН.
роЗродрпИ роЪрпЗроХро░ро┐роХрпНроХ ро╡рпЗрогрпНроЯро┐ропродрпБроорпН роироорпН рокрпКро▒рпБрокрпНрокрпБ родро╛ройрпН. 
роЗродро┐ро▓рпН ропро╛ро░ро╛ро╡родрпБ роЙродро╡ роорпБройрпН ро╡роирпНродро╛ро▓рпБроорпН роиройрпНро▒ро┐ропрпБроЯройрпН роПро▒рпНро▒рпБроХрпН роХрпКро│рпНроХро┐ро▒рпЛроорпН.

--------------------
роХрпЛро╡ро┐ро▓ро┐ро▓рпН роХрпЛро▓роорпН роЗроЯрпБро╡родро▒рпНроХрпБ роХрпЛро▓ роХрпБроЯрпНроЯрпБ рооро╛ро╡рпБроорпН 
роХрпЛро▓роорпН роЗроЯрпБро╡родро▒рпНроХрпБ роЕродро▒рпНроХрпБ роЙрогрпНроЯро╛рой
родрпБрогро┐роХро│рпБроорпН роХрпКрогрпНроЯрпБ ро╡роирпНродрпБ родро░рпБроХро┐ро▒рпЛроорпН 
-- 87782 82328 роП. роЖро░рпН роЕройрпНрокрпБ роЖро▒рпБроорпБроХроорпН:

--------------------
роХрпЛро▓роХрпНроХрпВроЯрпНроЯрпБ рооро╛ро╡рпБ родропро╛ро░рпН рокрогрпНрогро┐ 
ро╡рпЗро╖рпНроЯро┐ родрпБрогро┐ропрпБроорпН роХрпКрогрпНроЯрпБ ро╡ро░рпБроХро┐ро▒рпЗройрпН
-- 96293 45995 Sushila Shanmugam
[2/14/24, 6:54:03 PM] Senthil Mama Dubai: роЗройро┐роп рокро┐ро▒роирпНрод роиро╛ро│рпН ро╡ро╛ро┤рпНродрпНродрпБроХро│рпН роорогро┐ ЁЯТРЁЯОВЁЯТРЁЯОВЁЯТРЁЯОВЁЯТР. роОро▓рпНро▓ро╛ ро╡ро│роорпБроорпН рокрпЖро▒рпНро▒рпБ, родрооро┐ро┤рпН рокрпЛро▓, роирпАроЯрпВро┤ро┐ ро╡ро╛ро┤ роОро▓рпНро▓ро╛роорпНро╡ро▓рпНро▓ роЗро▒рпИро╡ройро┐роЯроорпН ро╡рпЗрогрпНроЯрпБроХро┐ро▒рпЛроорпН.
[2/14/24, 7:31:51 PM] Seetha Mami: Happy Birthday Mani Annan ЁЯТРЁЯОВЁЯТРStay Blessed
[2/14/24, 8:13:35 PM] Ramah Chitti: Happy Birthday Mani Annan ЁЯТРЁЯТРЁЯТР
[2/15/24, 12:57:19 AM] Nithyalalita Senthil Dubai: Happy Birthday Mani citthapa
тАО[2/15/24, 12:58:01 AM] Nithyalalita Senthil Dubai: тАОimage omitted
[2/15/24, 1:17:15 AM] Mani Mama Main: тАОThis message was deleted.
[2/15/24, 1:28:37 AM] Divya Sister: Happy Birthday mani mama ЁЯе│ЁЯТР
[2/15/24, 1:37:43 AM] Unna Mami: Happy birthday mani annanЁЯТРЁЯТРЁЯТР
[2/15/24, 2:28:28 AM] Santha Amma: тАОThis message was deleted.
[2/15/24, 2:29:06 AM] Santha Amma: Many more happy returns of the day ManiЁЯН░ЁЯН░ЁЯН░
[2/15/24, 2:31:53 AM] Meiyappan Appa Appachi: Many More happy returns of the day God bless you
[2/15/24, 9:11:16 AM] Mani Mama Main: тАОThis message was deleted.
[2/15/24, 9:17:14 AM] Uma Wifey Pendati: Happy Birthday Mani Chittapa ЁЯОВЁЯОВЁЯОВ
[2/15/24, 9:19:11 AM] Mani Mama Main: Thanks a lot for all your heartful greetingsЁЯТЧ
[2/15/24, 11:40:59 PM] Senthil Mama Dubai: ЁЯСЖ Almost ready
тАО[2/15/24, 11:41:00 PM] Senthil Mama Dubai: тАОvideo omitted
тАО[2/15/24, 11:41:06 PM] Senthil Mama Dubai: тАОvideo omitted
тАО[2/15/24, 11:41:07 PM] Senthil Mama Dubai: тАОvideo omitted
[2/18/24, 3:16:50 AM] Senthil Mama Dubai: We reached PMV
[2/18/24, 3:17:02 AM] Senthil Mama Dubai: Waiting for you all to come
[2/18/24, 11:51:13 PM] Mani Mama Main: ЁЯСНЁЯП╗ЁЯСНЁЯП╗
тАО[2/20/24, 8:30:00 AM] Senthil Mama Dubai: тАОimage omitted
тАО[2/20/24, 8:30:01 AM] Senthil Mama Dubai: тАОimage omitted
тАО[2/20/24, 8:30:01 AM] Senthil Mama Dubai: тАО<attached: 00000127-PHOTO-2024-02-20-08-30-02.jpg>
[2/20/24, 9:04:47 PM] Senthil Mama Dubai: Good Morning All
[2/20/24, 9:05:37 PM] Senthil Mama Dubai: All of you please do come to breakfast to PMV home
[2/20/24, 9:05:57 PM] Senthil Mama Dubai: Function is in full swing
[2/20/24, 9:06:48 PM] Senthil Mama Dubai: From here, we will go venthanpatti - transport arranged
[2/20/24, 9:42:57 PM] Seetha Mami: Excited to see you all
тАО[2/21/24, 10:24:47 AM] Seetha Mami: тАО<attached: 00000133-PHOTO-2024-02-21-10-24-48.jpg>
[2/21/24, 7:05:42 PM] Seetha Mami: https://www.youtube.com/live/qtP8KeHGUQM?si=2u9XJrPJdn4wxhUv
[2/21/24, 7:05:43 PM] Seetha Mami: Today live
[3/2/24, 9:43:38 PM] Seetha Mami: Many More Happy Returns Of The Day Ayithan ЁЯТРЁЯОВЁЯТРStay Blessed
тАО[3/2/24, 10:07:45 PM] Senthil Mama Dubai: тАО<attached: 00000137-PHOTO-2024-03-02-22-07-46.jpg>
[3/2/24, 11:52:36 PM] Mani Mama Main: Many more Happy returns of the day Ayithan ЁЯОВЁЯОВ
[3/3/24, 12:43:55 AM] Unna Mami: Happy birthday annanЁЯТРЁЯТРЁЯТР
[3/3/24, 2:10:49 AM] Karthik 2 Cousin: Happy birthday mama..ЁЯе│ЁЯОК@919444801887
[3/3/24, 5:27:47 AM] Meiyappan Appa Appachi: Thanks Seetha, Senthil,Kavitha, Unna & Karthik
тАО[3/3/24, 6:57:07 AM] Mani Mama Main: тАО<attached: 00000142-PHOTO-2024-03-03-06-57-08.jpg>
тАО[3/3/24, 8:54:43 AM] Nithyalalita Senthil Dubai: тАО<attached: 00000143-PHOTO-2024-03-03-08-54-44.jpg>
тАО[3/4/24, 5:06:52 AM] Mani Mama Main: тАО<attached: 00000144-VIDEO-2024-03-04-05-06-53.mp4>
[3/4/24, 7:27:08 AM] Meiyappan Appa Appachi: Thanks Mani &Nithya
[3/12/24, 6:09:10 AM] Seetha Mami: Happy Birthday Uma ЁЯТРЁЯОВЁЯТРStay Blessed
[3/12/24, 6:18:47 AM] Senthil Mama Dubai: Many More Happy Returns of the Day Uma.ЁЯОВЁЯТРЁЯОВЁЯТРЁЯОВLong Live. God Bless You.
[3/12/24, 6:20:04 AM] Mani Mama Main: Happy birthday uma ЁЯОВЁЯОВЁЯТРЁЯТР
[3/12/24, 7:04:59 AM] Meiyappan Appa Appachi: Happy Birthday Uma ЁЯОЙЁЯОЙЁЯОЙ
[3/12/24, 7:14:21 AM] Unna Mami: Happy birthday umaЁЯТРЁЯТРЁЯТР
[3/12/24, 10:12:05 AM] Uma Wifey Pendati: Thank you so much for the wishes Seetha chitti, Kasi Chittapa, Kavitha chitti, Mama and Unna Chitti ЁЯдЧ.
[3/12/24, 10:31:49 AM] Ramah Chitti: Happy birthday Uma
[3/12/24, 10:33:38 AM] Nithyalalita Senthil Dubai: Happy birthday Uma Akka ЁЯе│ЁЯОВ
[3/12/24, 2:11:52 PM] Uma Wifey Pendati: Thank you so much for the wishes Ramah athai and Nithya ЁЯдЧ.
[3/14/24, 10:51:31 AM] Mani Mama Main: Belated Happy birthday wishes uma..God bless you.
[3/15/24, 10:03:05 AM] Uma Wifey Pendati: Thank you so much for the wishes Mani Chittapa ЁЯдЧ
